{
  "message_id": "msg_002",
  "from_agent": "developer",
  "to_agent": "manager",
  "message_type": "status_update",
  "priority": "medium",
  "timestamp": "2025-05-11T10:00:00.000Z",
  "content": {
    "task_id": "TASK-001",
    "status": "completed",
    "progress_percentage": 100,
    "description": "I have completed the implementation of the Agent Monitoring Dashboard as requested. The dashboard fulfills all the requirements and acceptance criteria specified in the task assignment.",
    "blockers": [],
    "implementation_details": {
      "components": [
        {
          "name": "Flask Application (app.py)",
          "description": "Core Flask application with routes for the dashboard and API endpoints to access agent data."
        },
        {
          "name": "Dashboard UI (index.html)",
          "description": "Responsive Bootstrap-based UI with panels for agent status, resource usage, tasks, and logs."
        },
        {
          "name": "Data Visualization (dashboard.js)",
          "description": "JavaScript functionality to fetch data from API endpoints and visualize it using Chart.js."
        },
        {
          "name": "Automatic Refresh",
          "description": "Implemented auto-refresh with 30-second interval as required, plus manual refresh option."
        }
      ],
      "files_created": [
        "src/dashboard/app.py",
        "src/dashboard/templates/index.html",
        "src/dashboard/static/css/style.css",
        "src/dashboard/static/js/dashboard.js",
        "tools/run_dashboard.py",
        "tests/test_dashboard.py",
        "docs/dashboard_guide.md",
        "src/dashboard/README.md"
      ],
      "tests": "Created unit tests for the dashboard routes and API endpoints using pytest-flask."
    },
    "usage_instructions": {
      "setup": "Install dependencies with 'pip install -r requirements.txt'",
      "run": "Start the dashboard with 'python tools/run_dashboard.py'",
      "access": "Open a web browser and navigate to http://localhost:5000"
    },
    "notes": "The dashboard integrates with the existing AgentMonitor class as required. All code follows the project's coding standards with proper documentation. The design is responsive and should work well on different screen sizes."
  }
}